{
  "schema_version": "1.0.0-draft",
  "kind": "capabilities",
  "source_date": "2026-10-12",
  "note": "来源声明的配置模板，全部关闭。null不是无限制；通过后台导入编辑，补齐绑定/约束/价格与实测后方可发布。",
  "yunfei_scenarios": [
    "gpt-text",
    "gpt-edit",
    "banana-text",
    "banana-edit",
    "grok-video-submit",
    "grok-video-image",
    "grok-video-result",
    "omni-video-submit",
    "omni-video-image",
    "omni-video-result",
    "veo-text",
    "veo-image",
    "veo-frames",
    "veo-ref",
    "audio-chat",
    "audio-submit",
    "audio-compat",
    "audio-models",
    "audio-endpoints"
  ],
  "profiles": [
    {
      "profile_id": "yunfei:gpt-image-2",
      "version": "draft-v1",
      "provider": "yunfei",
      "model": "gpt-image-2",
      "upstream_model": "gpt-image-2",
      "adapter": "yunfei_gpt_images",
      "media_type": "image",
      "enabled": false,
      "status": "draft",
      "validation_status": "待渠道验证",
      "source": "https://doc.yunfei.best/",
      "scenarios": [
        "gpt-text",
        "gpt-edit"
      ],
      "operations": [
        "image",
        "image_edit"
      ],
      "formats": [
        "json",
        "multipart"
      ],
      "duration": {
        "mode": "not_applicable",
        "values": [],
        "min": null,
        "max": null,
        "default": null,
        "required": false,
        "scenarios": []
      },
      "resolutions": [
        "1K",
        "2K",
        "4K"
      ],
      "aspect_ratios": null,
      "qualities": [
        "medium",
        "high"
      ],
      "resolution_policy": "native",
      "materials": {
        "image": {
          "formats": [
            "file_png",
            "file_jpeg",
            "file_webp"
          ],
          "max_count": null,
          "max_file_bytes": null,
          "max_duration_seconds": null
        },
        "video": {
          "formats": [],
          "max_count": 0,
          "max_file_bytes": null,
          "max_duration_seconds": null
        },
        "audio": {
          "formats": [],
          "max_count": 0,
          "max_file_bytes": null,
          "max_duration_seconds": null
        }
      },
      "field_mapping": {
        "image": "multipart:image[]",
        "size": "size",
        "quality": "quality"
      },
      "constraints": [
        {
          "n": 1,
          "depends_on_authorized_group": true
        }
      ],
      "unverified": [
        "max_request_bytes",
        "max_concurrent_tasks",
        "observation_seconds",
        "real_generation",
        "image.max_count",
        "image.max_file_bytes",
        "size_pixel_enum_by_group"
      ],
      "delivery": {
        "poll_seconds": 10,
        "head": null,
        "range": null,
        "refresh": null
      },
      "limits": {
        "max_request_bytes": null,
        "max_concurrent_tasks": null,
        "observation_seconds": null
      }
    },
    {
      "profile_id": "yunfei:gemini-3-pro-image-preview",
      "version": "draft-v1",
      "provider": "yunfei",
      "model": "gemini-3-pro-image-preview",
      "upstream_model": "gemini-3-pro-image-preview",
      "adapter": "yunfei_gemini_native",
      "media_type": "image",
      "enabled": false,
      "status": "draft",
      "validation_status": "待渠道验证",
      "source": "https://doc.yunfei.best/",
      "scenarios": [
        "banana-text",
        "banana-edit"
      ],
      "operations": [
        "gemini_image"
      ],
      "formats": [
        "json"
      ],
      "duration": {
        "mode": "not_applicable",
        "values": [],
        "min": null,
        "max": null,
        "default": null,
        "required": false,
        "scenarios": []
      },
      "resolutions": [
        "1K",
        "2K",
        "4K"
      ],
      "aspect_ratios": [
        "1:1",
        "16:9",
        "9:16",
        "4:3",
        "3:4",
        "3:2",
        "2:3",
        "5:4",
        "4:5",
        "21:9"
      ],
      "qualities": null,
      "resolution_policy": "native",
      "materials": {
        "image": {
          "formats": [
            "inline_data",
            "file_data"
          ],
          "max_count": null,
          "max_file_bytes": null,
          "max_duration_seconds": null
        },
        "video": {
          "formats": [],
          "max_count": 0,
          "max_file_bytes": null,
          "max_duration_seconds": null
        },
        "audio": {
          "formats": [],
          "max_count": 0,
          "max_file_bytes": null,
          "max_duration_seconds": null
        }
      },
      "field_mapping": {
        "image": "contents[].parts[]",
        "size": "generationConfig.imageConfig.imageSize"
      },
      "constraints": [
        {
          "n": 1,
          "depends_on_authorized_group": true
        },
        {
          "automatic_aspect_ratio": "omit",
          "TEXT_url_output": "provider_extension"
        }
      ],
      "unverified": [
        "max_request_bytes",
        "max_concurrent_tasks",
        "observation_seconds",
        "real_generation",
        "image.max_count",
        "image.max_file_bytes",
        "channel_validation_of_source_declared_aspect_ratios"
      ],
      "delivery": {
        "poll_seconds": 10,
        "head": null,
        "range": null,
        "refresh": null
      },
      "limits": {
        "max_request_bytes": null,
        "max_concurrent_tasks": null,
        "observation_seconds": null
      }
    },
    {
      "profile_id": "yunfei:gemini-3.1-flash-image-preview",
      "version": "draft-v1",
      "provider": "yunfei",
      "model": "gemini-3.1-flash-image-preview",
      "upstream_model": "gemini-3.1-flash-image-preview",
      "adapter": "yunfei_gemini_native",
      "media_type": "image",
      "enabled": false,
      "status": "draft",
      "validation_status": "待渠道验证",
      "source": "https://doc.yunfei.best/",
      "scenarios": [
        "banana-text",
        "banana-edit"
      ],
      "operations": [
        "gemini_image"
      ],
      "formats": [
        "json"
      ],
      "duration": {
        "mode": "not_applicable",
        "values": [],
        "min": null,
        "max": null,
        "default": null,
        "required": false,
        "scenarios": []
      },
      "resolutions": [
        "1K",
        "2K",
        "4K"
      ],
      "aspect_ratios": [
        "1:1",
        "16:9",
        "9:16",
        "4:3",
        "3:4",
        "3:2",
        "2:3",
        "5:4",
        "4:5",
        "21:9",
        "8:1",
        "4:1",
        "1:4",
        "1:8"
      ],
      "qualities": null,
      "resolution_policy": "native",
      "materials": {
        "image": {
          "formats": [
            "inline_data",
            "file_data"
          ],
          "max_count": null,
          "max_file_bytes": null,
          "max_duration_seconds": null
        },
        "video": {
          "formats": [],
          "max_count": 0,
          "max_file_bytes": null,
          "max_duration_seconds": null
        },
        "audio": {
          "formats": [],
          "max_count": 0,
          "max_file_bytes": null,
          "max_duration_seconds": null
        }
      },
      "field_mapping": {
        "image": "contents[].parts[]",
        "size": "generationConfig.imageConfig.imageSize"
      },
      "constraints": [
        {
          "n": 1,
          "depends_on_authorized_group": true
        },
        {
          "automatic_aspect_ratio": "omit",
          "TEXT_url_output": "provider_extension"
        }
      ],
      "unverified": [
        "max_request_bytes",
        "max_concurrent_tasks",
        "observation_seconds",
        "real_generation",
        "image.max_count",
        "image.max_file_bytes",
        "channel_validation_of_source_declared_aspect_ratios"
      ],
      "delivery": {
        "poll_seconds": 10,
        "head": null,
        "range": null,
        "refresh": null
      },
      "limits": {
        "max_request_bytes": null,
        "max_concurrent_tasks": null,
        "observation_seconds": null
      }
    },
    {
      "profile_id": "yunfei:grok-imagine-video",
      "version": "draft-v1",
      "provider": "yunfei",
      "model": "grok-imagine-video",
      "upstream_model": "grok-imagine-video",
      "adapter": "yunfei_grok",
      "media_type": "video",
      "enabled": false,
      "status": "draft",
      "validation_status": "待渠道验证",
      "source": "https://doc.yunfei.best/",
      "scenarios": [
        "grok-video-submit",
        "grok-video-image",
        "grok-video-result"
      ],
      "operations": [
        "video"
      ],
      "formats": [
        "json",
        "multipart"
      ],
      "duration": {
        "mode": "range",
        "values": [],
        "min": 1,
        "max": 15,
        "default": 8,
        "required": false,
        "scenarios": []
      },
      "resolutions": [
        "480p",
        "720p"
      ],
      "aspect_ratios": [
        "1:1",
        "16:9",
        "9:16",
        "4:3",
        "3:4",
        "3:2",
        "2:3"
      ],
      "qualities": null,
      "resolution_policy": "enum",
      "materials": {
        "image": {
          "formats": [
            "url_object",
            "data_url_in_url_object",
            "base64_in_url_object",
            "multipart_input_reference"
          ],
          "max_count": 1,
          "max_file_bytes": null,
          "max_duration_seconds": null
        },
        "video": {
          "formats": [],
          "max_count": 0,
          "max_file_bytes": null,
          "max_duration_seconds": null
        },
        "audio": {
          "formats": [],
          "max_count": 0,
          "max_file_bytes": null,
          "max_duration_seconds": null
        }
      },
      "field_mapping": {
        "seconds": "duration",
        "image": "image.url",
        "resolution": "resolution"
      },
      "constraints": [
        {